<?xml version="1.0" encoding="UTF-8"?>
<!--Sample XML file generated by XMLSpy v2006 rel. 3 U (http://www.altova.com)-->
<CONFIG-EVENTS-CONSTRAINTS xmlns:xsi="http://www.w3.org/2001/XMLSchema-instance" xsi:noNamespaceSchemaLocation=".\ConfigEventsConstraints.xsd">
	<EVENT>
		<SHORT-NAME>DataReceivedEvent</SHORT-NAME>
		<EVENT-REF DEST="TIMING-EVENT">/RootP_Mode/ApplicationModeGroup/APP_WAKEUP</EVENT-REF>
		<DURATION>0.05</DURATION>
	</EVENT>
	<EVENT>
		<SHORT-NAME>RUNI_A26_EXIT</SHORT-NAME>
		<EVENT-REF DEST="SWC-MODE-SWITCH-EVENT">/RootP_ASWC_A26/ASWC_A26/IB_ASWC_A26/RUNI_A26_EXIT</EVENT-REF>
		<!--BEFORE-EVENT-REF DEST="SWC-MODE-SWITCH-EVENT">/RootP_ASWC_A26/ASWC_A26/IB_ASWC_A26/RUNPI_ASWC_A26_ENTRY</BEFORE-EVENT-REF-->
		<!--EVENTS-CALLED DEST="SWC-MODE-SWITCH-EVENT">/RootP_ASWC_A26/ASWC_A26/IB_ASWC_A26/RUNPI_ASWC_A26_ENTRY</EVENTS-CALLED-->
	</EVENT>
	<EVENT>
		<SHORT-NAME>RUNPI_ASWC_A26_ENTRY</SHORT-NAME>
		<EVENT-REF DEST="SWC-MODE-SWITCH-EVENT">/RootP_ASWC_A26/ASWC_A26/IB_ASWC_A26/RUNPI_ASWC_A26_ENTRY</EVENT-REF>
		<BEFORE-EVENT-REF DEST="TIMING-EVENT">/RootP_ASWC_A26/ASWC_A26/IB_ASWC_A26/DataReceivedEvent</BEFORE-EVENT-REF>
		<AFTER-EVENT-REF DEST="TIMING-EVENT">/RootP_ASWC_A26/ASWC_A26/IB_ASWC_A26/RUNI_A26_EXIT</AFTER-EVENT-REF>
	</EVENT>
</CONFIG-EVENTS-CONSTRAINTS>
