<?xml version="1.0" encoding="UTF-8"?>
<!--Sample XML file generated by XMLSpy v2006 rel. 3 U (http://www.altova.com)-->
<CONFIG-EVENTS-CONSTRAINTS xmlns:xsi="http://www.w3.org/2001/XMLSchema-instance" xsi:noNamespaceSchemaLocation=".\ConfigEventsConstraints.xsd">
	<EVENT>
		<SHORT-NAME>DataReceived1Event</SHORT-NAME>
		<EVENT-REF DEST="SWC-MODE-SWITCH-EVENT">/RootP_ASWC_A26/ASWC_A26/IB_ASWC_A26/DataReceived1Event</EVENT-REF>
	</EVENT>
	<EVENT>
		<SHORT-NAME>DataReceived2Event</SHORT-NAME>
		<EVENT-REF DEST="SWC-MODE-SWITCH-EVENT">/RootP_ASWC_A26/ASWC_A26/IB_ASWC_A26/DataReceived2Event</EVENT-REF>
	</EVENT>
	<EVENT>
		<SHORT-NAME>DataReceived3Event</SHORT-NAME>
		<EVENT-REF DEST="SWC-MODE-SWITCH-EVENT">/RootP_ASWC_A26/ASWC_A26/IB_ASWC_A26/DataReceived3Event</EVENT-REF>
		<BEFORE-EVENT-REF>
			<EVENT-REF DEST="SWC-MODE-SWITCH-EVENT">/RootP_ASWC_A26/ASWC_A26/IB_ASWC_A26/DataReceived1Event</EVENT-REF>
		</BEFORE-EVENT-REF>
		<AFTER-EVENT-REF>
			<EVENT-REF DEST="SWC-MODE-SWITCH-EVENT">/RootP_ASWC_A26/ASWC_A26/IB_ASWC_A26/DataReceived2Event</EVENT-REF>
		</AFTER-EVENT-REF>
	</EVENT>
</CONFIG-EVENTS-CONSTRAINTS>
