<?xml version="1.0" encoding="UTF-8"?>
<!--Sample XML file generated by XMLSpy v2006 rel. 3 U (http://www.altova.com)-->
<CONFIG-EVENTS-CONSTRAINTS xmlns:xsi="http://www.w3.org/2001/XMLSchema-instance" xsi:noNamespaceSchemaLocation=".\ConfigEventsConstraints.xsd">
	<EVENT>
		<SHORT-NAME>RUNA_GererAutomonieConso_Cyclic</SHORT-NAME>
		<EVENT-REF DEST="TIMING-EVENT">/RootP_ASWC_A26/ASWC_A26/IB_ASWC_A26/RUNA_GererAutomonieConso_Cyclic</EVENT-REF>
		<EVENTS-CALLED DEST="SWC-MODE-SWITCH-EVENT">/RootP_ASWC_A27/ASWC_A27/IB_ASWC_A27/RUNA_GererCptTempVhl_Cyclic</EVENTS-CALLED>
		<CONTAIN-IMPLICIT-ACCESS>false</CONTAIN-IMPLICIT-ACCESS>
		<DURATION>0.05</DURATION>
		<UNMAPPED>false</UNMAPPED>
	</EVENT>
	<EVENT>
		<SHORT-NAME>RUNA_GererCptTempVhl_Cyclic</SHORT-NAME>
		<EVENT-REF DEST="SWC-MODE-SWITCH-EVENT">/RootP_ASWC_A27/ASWC_A27/IB_ASWC_A27/RUNA_GererCptTempVhl_Cyclic</EVENT-REF>
	</EVENT>
</CONFIG-EVENTS-CONSTRAINTS>
