<?xml version="1.0" encoding="UTF-8"?>
<!--Sample XML file generated by XMLSpy v2006 rel. 3 U (http://www.altova.com)-->
<CONFIG-EVENTS-CONSTRAINTS xmlns:xsi="http://www.w3.org/2001/XMLSchema-instance" xsi:noNamespaceSchemaLocation=".\ConfigEventsConstraints.xsd">
	<EVENT>
		<SHORT-NAME>RUNA_GererAutomonieConso_Cyclic</SHORT-NAME>
		<EVENT-REF DEST="TIMING-EVENT">/RootP_ASWC_A26/ASWC_A26/IB_ASWC_A26/RUNA_GererAutomonieConso_Cyclic</EVENT-REF>
		<DURATION>0.05</DURATION>
	</EVENT>
	<EVENT>
		<SHORT-NAME>RUNI_A26_EXIT</SHORT-NAME>
		<EVENT-REF DEST="TIMING-EVENT">/RootP_ASWC_A26/ASWC_A26/IB_ASWC_A26/RUNI_A26_EXIT</EVENT-REF>
		<DURATION>0.05</DURATION>
		<!--AFTER-EVENT-REF DEST="SWC-MODE-SWITCH-EVENT">/RootP_ASWC_A26/ASWC_A26/IB_ASWC_A26/RUNPI_ASWC_A26_ENTRY</AFTER-EVENT-REF-->
	</EVENT>
</CONFIG-EVENTS-CONSTRAINTS>
